{
  "$schema": "http://json-schema.org/draft-07/schema#",
  "title": "CasesSchema",
  "type": "array",
  "items": {
    "type": "object",
    "required": ["description"],
    "properties": {
      "description": { "type": "string" },
      "input": { "type": "object" },
      "expectedScore": { "type": "number" },
      "expectedFlagLevel": { "type": ["string", "null"] }
    }
  }
}
